{
  "schema_version": 2,
  "description": "Move slot definitions for the VPG Engine. Each slot is a unique input/state combination that a move can be assigned to.",
  "field_definitions": {
    "slot_id": "Unique identifier for this slot. Used to assign moves to slots.",
    "slot_display_name": "Pretty name for UI display.",
    "position": "Broad area of the game system.",
    "category": "Functional grouping within a position (UI-ready title case).",
    "category_id": "snake_case version of category, for code references.",
    "group": "Eligibility group; moves reference groups, not individual slots.",
    "actor_state": "Array of states the actor (the wrestler performing the move) must be in for this slot to be valid (any of these). Not the same as the engagement role: on a counter slot the actor is the engagement's defender.",
    "target_state": "Array of states the target (the wrestler the move is performed on) must be in (any of these). 'n/a' means the slot has no target, as for taunts and evasion.",
    "range": "Distance modifier: close, mid, any, or n/a.",
    "requires_special": "True if special meter is required to trigger this slot.",
    "trigger": "'manual' (player input fires the slot) or 'automatic' (engine fires it from context).",
    "input": "Human-readable input description, for UI/tooltips.",
    "input_pattern": "Structured input matcher for the engine. Null for automatic slots.",
    "input_pattern.buttons": "Buttons that must all be pressed simultaneously. Mutually exclusive with mash_buttons.",
    "input_pattern.mash_buttons": "Pool of buttons for rapid-tap (mashing) slots. Any press of any pool button counts toward the mash; engine fires the slot when press count exceeds threshold within a time window.",
    "input_pattern.button_alternatives": "Groups of 'either/or' button options, e.g. [['a','b']] for '[A] or [B]'. Player presses any one button from each group.",
    "input_pattern.dpad": "Acceptable d-pad directions: array of 'up'/'down'/'left'/'right', or ['any'], or null if d-pad isn't part of the input.",
    "input_pattern.control_stick": "Acceptable control stick flick directions, same shape as dpad.",
    "input_pattern.modifier": "'tap' | 'hold' | 'rapid_tap' | null. Distinguishes weak/strong grapples and mash inputs.",
    "input_pattern.requires_run": "True if [Run] must be held when the input is given.",
    "input_pattern.release_run": "True if the slot fires on RELEASE of [Run] (not press). Used by turnbuckle flying attacks: requires_run=true + release_run=true together mean 'player ran into corner to climb the turnbuckle, slot fires when [Run] is released to launch the move'.",
    "setup": "Human-readable description of how to perform the move, for help/training UI."
  },
  "slots": [
    {
      "slot_id": "apron_kick_to_inside",
      "slot_display_name": "Apron Kick To Inside",
      "position": "apron",
      "category": "Apron Strike",
      "category_id": "apron_strike",
      "group": "apron_kick",
      "actor_state": [
        "on_apron"
      ],
      "target_state": [
        "standing_facing_player",
        "standing_facing_away"
      ],
      "range": "close",
      "requires_special": false,
      "trigger": "manual",
      "input": "[B]",
      "input_pattern": {
        "dpad": null,
        "control_stick": null,
        "modifier": null,
        "requires_run": false,
        "release_run": false,
        "buttons": [
          "b"
        ]
      },
      "setup": "Press [B] while on the apron toward an opponent inside or outside"
    },
    {
      "slot_id": "apron_kick_to_outside",
      "slot_display_name": "Apron Kick To Outside",
      "position": "apron",
      "category": "Apron Strike",
      "category_id": "apron_strike",
      "group": "apron_kick",
      "actor_state": [
        "on_apron"
      ],
      "target_state": [
        "outside_ring"
      ],
      "range": "close",
      "requires_special": false,
      "trigger": "manual",
      "input": "[B]",
      "input_pattern": {
        "dpad": null,
        "control_stick": null,
        "modifier": null,
        "requires_run": false,
        "release_run": false,
        "buttons": [
          "b"
        ]
      },
      "setup": "Press [B] while on the apron toward an opponent inside or outside"
    },
    {
      "slot_id": "apron_taunt",
      "slot_display_name": "Apron Taunt",
      "position": "apron",
      "category": "Apron Taunt",
      "category_id": "apron_taunt",
      "group": "apron_taunt",
      "actor_state": [
        "on_apron"
      ],
      "target_state": [
        "n/a"
      ],
      "range": "n/a",
      "requires_special": false,
      "trigger": "manual",
      "input": "[Control Stick]",
      "input_pattern": {
        "dpad": null,
        "control_stick": [
          "any"
        ],
        "modifier": null,
        "requires_run": false,
        "release_run": false,
        "buttons": []
      },
      "setup": "Press [Control Stick] while on the apron"
    },
    {
      "slot_id": "counter_grapple_from_apron_apron",
      "slot_display_name": "Counter Grapple From Apron Apron",
      "position": "apron",
      "category": "Counter Grapple from Apron",
      "category_id": "counter_grapple_from_apron",
      "group": "counter_grapple_from_apron_apron",
      "actor_state": [
        "apron_weak_grapple_from_apron_defending",
        "apron_strong_grapple_from_apron_defending"
      ],
      "target_state": [
        "apron_weak_grapple_from_apron_attacking",
        "apron_strong_grapple_from_apron_attacking"
      ],
      "range": "n/a",
      "requires_special": false,
      "trigger": "manual",
      "input": "Rapidly tap [A] and [B]",
      "input_pattern": {
        "dpad": null,
        "control_stick": null,
        "modifier": "rapid_tap",
        "requires_run": false,
        "release_run": false,
        "mash_buttons": [
          "a",
          "b"
        ]
      },
      "setup": "Rapidly tap [A] and [B] while defending a grapple on the apron"
    },
    {
      "slot_id": "flying_attack_from_apron",
      "slot_display_name": "Flying Attack From Apron",
      "position": "apron",
      "category": "Flying Attack from Apron",
      "category_id": "flying_attack_from_apron",
      "group": "flying_attack_from_apron",
      "actor_state": [
        "on_apron"
      ],
      "target_state": [
        "outside_ring"
      ],
      "range": "any",
      "requires_special": false,
      "trigger": "manual",
      "input": "[D-Pad] + [A]",
      "input_pattern": {
        "dpad": [
          "any"
        ],
        "control_stick": null,
        "modifier": null,
        "requires_run": false,
        "release_run": false,
        "buttons": [
          "a"
        ]
      },
      "setup": "Press [D-Pad] + [A] while on the apron toward opponent outside"
    },
    {
      "slot_id": "running_flying_attack_from_apron",
      "slot_display_name": "Running Flying Attack From Apron",
      "position": "apron",
      "category": "Flying Attack from Apron",
      "category_id": "flying_attack_from_apron",
      "group": "running_flying_attack_from_apron",
      "actor_state": [
        "running_on_apron"
      ],
      "target_state": [
        "outside_ring"
      ],
      "range": "any",
      "requires_special": false,
      "trigger": "manual",
      "input": "[A]",
      "input_pattern": {
        "dpad": null,
        "control_stick": null,
        "modifier": null,
        "requires_run": false,
        "release_run": false,
        "buttons": [
          "a"
        ]
      },
      "setup": "Hold [Run] on the apron then press [A] toward opponent outside"
    },
    {
      "slot_id": "flying_attack_to_ring_laying",
      "slot_display_name": "Flying Attack To Ring Laying",
      "position": "apron",
      "category": "Flying Attack to Ring (Laying)",
      "category_id": "flying_attack_to_ring_laying",
      "group": "flying_attack_to_ring_laying",
      "actor_state": [
        "on_apron"
      ],
      "target_state": [
        "down_in_ring"
      ],
      "range": "any",
      "requires_special": false,
      "trigger": "manual",
      "input": "[A]",
      "input_pattern": {
        "dpad": null,
        "control_stick": null,
        "modifier": null,
        "requires_run": false,
        "release_run": false,
        "buttons": [
          "a"
        ]
      },
      "setup": "Press [A] on the apron toward a downed opponent inside"
    },
    {
      "slot_id": "flying_attack_to_ring_special",
      "slot_display_name": "Flying Attack To Ring Special",
      "position": "apron",
      "category": "Flying Attack to Ring (Special)",
      "category_id": "flying_attack_to_ring_special",
      "group": "flying_attack_to_ring_special",
      "actor_state": [
        "on_apron"
      ],
      "target_state": [
        "standing_facing_player",
        "standing_facing_away",
        "down_in_ring"
      ],
      "range": "any",
      "requires_special": true,
      "trigger": "manual",
      "input": "[A]",
      "input_pattern": {
        "dpad": null,
        "control_stick": null,
        "modifier": null,
        "requires_run": false,
        "release_run": false,
        "buttons": [
          "a"
        ]
      },
      "setup": "Press [A] with special meter on the apron toward an opponent inside"
    },
    {
      "slot_id": "flying_attack_to_ring_standing",
      "slot_display_name": "Flying Attack To Ring Standing",
      "position": "apron",
      "category": "Flying Attack to Ring (Standing)",
      "category_id": "flying_attack_to_ring_standing",
      "group": "flying_attack_to_ring_standing",
      "actor_state": [
        "on_apron"
      ],
      "target_state": [
        "standing_facing_player",
        "standing_facing_away"
      ],
      "range": "any",
      "requires_special": false,
      "trigger": "manual",
      "input": "[A]",
      "input_pattern": {
        "dpad": null,